awardgoverningsocietyid,awardgoverningsocietyname,awardid,awardname,awardreceivedid,awardreceivedname,awardreceivedawardyear,AAUID,clientfacultyid,orcid,personname,institutionname,prestige,asofdate
199,"Institute for Operations Research and the Management Sciences (INFORMS)",24259,"Information Systems Society/ISS Bapna-Ghose Social Justice Best Paper Award",1753066,"Abraham Seidmann","2023",103199,"U68454931","0000-0003-1822-5294","SEIDMANN, ABRAHAM","Boston University","Not Designated",12/6/2024 3:24:46 AM
222,"National Academy of Sciences",7494,"Kavli Frontiers of Science Fellows",1072316,"Kamal Sen","2003",103278,"U90693139","0000-0002-9741-0836","SEN, KAMAL","Boston University","Not Designated",12/6/2024 3:24:46 AM
234,"National Endowment for the Humanities (NEH)",3769,"NEH Fellowships for College Teachers and Independent Scholars",331433,"Nancy J. Smith-Hefner","1995",104773,"U71107518","","SMITH-HEFNER, NANCY","Boston University","Highly Prestigious",12/6/2024 3:24:46 AM
374,"Harvard Radcliffe Institute for Advanced Study",2887,"Radcliffe Institute Fellowship",254272,"Nancy J. Smith-Hefner","2009",104773,"U71107518","","SMITH-HEFNER, NANCY","Boston University","Prestigious",12/6/2024 3:24:46 AM
234,"National Endowment for the Humanities (NEH)",3769,"NEH Fellowships for College Teachers and Independent Scholars",27621,"Nancy J. Smith-Hefner","2002",104773,"U71107518","","SMITH-HEFNER, NANCY","Boston University","Highly Prestigious",12/6/2024 3:24:46 AM
279,"Society of Architectural Historians",2438,"Founders' JSAH Article Award",56775,"Alice Y. Tseng","2006",109814,"U77827405","","TSENG, ALICE Y","Boston University","Prestigious",12/6/2024 3:24:46 AM
190,"Getty Foundation, The",1807,"Getty Research Institute-Residential Postdoctoral Fellowship",62484,"Tseng, Alice","2005",109814,"U77827405","","TSENG, ALICE Y","Boston University","Not Designated",12/6/2024 3:24:46 AM
330,"Association for Asian Studies",2713,"AAS NEAC Japan Studies Grants",322581,"Alice Y. Tseng","2011",109814,"U77827405","","TSENG, ALICE Y","Boston University","Prestigious",12/6/2024 3:24:46 AM
54,"American Council of Learned Societies (ACLS)",479,"ACLS Fellows (ACLS/SSRC/NEH International and Area Studies Fellowships and ACLS/New York Public Library Fellowships)",315964,"Alice Y. Tseng","2012",109814,"U77827405","","TSENG, ALICE Y","Boston University","Highly Prestigious",12/6/2024 3:24:46 AM
1460,"United States Department of State, Bureau of Educational and Cultural Affairs",7531,"Fulbright U.S. Student Program",703104,"Tseng, Alice Y.","2000",109814,"U77827405","","TSENG, ALICE Y","Boston University","Not Designated",12/6/2024 3:24:46 AM
259,"Center for the Advanced Study in the Visual Arts",3032,"Predoctoral Fellowship Program",737891,"Alice Y. Tseng","2002",109814,"U77827405","","TSENG, ALICE Y","Boston University","Not Designated",12/6/2024 3:24:46 AM
190,"Getty Foundation, The",18677,"Getty Foundation Postdoctoral Fellowships",1351765,"Alice Tseng","2006",109814,"U77827405","","TSENG, ALICE Y","Boston University","Not Designated",12/6/2024 3:24:46 AM
1101,"Academy of Management",6156,"Health Care Management Division/Outstanding Reviewer Award",550035,"Anita Tucker","2006",109994,"U55151085","0000-0001-9765-7372","CARSON, ANITA","Boston University","Not Designated",12/6/2024 3:24:46 AM
199,"Institute for Operations Research and the Management Sciences (INFORMS)",6245,"Manufacturing and Service Operations Management/Service Management SIG Best Paper Award",878875,"Anita L. Tucker","2018",109994,"U55151085","0000-0001-9765-7372","CARSON, ANITA","Boston University","Not Designated",12/6/2024 3:24:46 AM
469,"American Automatic Control Council",3524,"O. Hugo Schuck Best Paper Award",212628,"Hua O. Wang","1994",112691,"U35190453","","WANG, HUA","Boston University","Not Designated",12/6/2024 3:24:46 AM
134,"American Society of Ichthyologists and Herpetologists",10628,"Gaige Fund Award",995373,"Karen M. Warkentin","1993",112873,"U20412047","0000-0002-7804-800X","WARKENTIN, KAREN","Boston University","Not Designated",12/6/2024 3:24:46 AM
818,"Animal Behavior Society",7510,"ABS Fellows",1572952,"Karen Michelle Warkentin","2022",112873,"U20412047","0000-0002-7804-800X","WARKENTIN, KAREN","Boston University","Not Designated",12/6/2024 3:24:46 AM
134,"American Society of Ichthyologists and Herpetologists",17085,"Best Papers",1766686,"Karen M. Warkentin","2021",112873,"U20412047","0000-0002-7804-800X","WARKENTIN, KAREN","Boston University","Not Designated",12/6/2024 3:24:46 AM
3,"Alfred P. Sloan Foundation",30,"Sloan Research Fellowship-Physics",617391,"Ahlen, Steven","1984",113370,"U41387593","0000-0001-6098-7247","AHLEN, STEVEN P","Boston University","Prestigious",12/6/2024 3:24:46 AM
318,"American Society for Biochemistry and Molecular Biology",19214,"ASBMB Fellow",1417824,"Karen Allen","2021",113648,"U17286673","0000-0001-7296-0551","ALLEN, KAREN N","Boston University","Not Designated",12/6/2024 3:24:46 AM
41,"American Chemical Society",3613,"Abeles and Jencks Award for the Chemistry of Biological Processes",1523880,"Karen Allen","2022",113648,"U17286673","0000-0001-7296-0551","ALLEN, KAREN N","Boston University","Not Designated",12/6/2024 3:24:46 AM
856,"Institute of Materials, Minerals and Mining",4060,"Mann Redmayne Medals A, B, and C",345084,"Uday B Pal","2009",113949,"U25610682","0000-0001-5020-9396","PAL, UDAY","Boston University","Not Designated",12/6/2024 3:24:46 AM
75,"American Institute of Mining, Metallurgical, and Petroleum Engineers(AIME)",679,"James Douglas Gold Medal",537141,"Uday Bhanu Pal","2015",113949,"U25610682","0000-0001-5020-9396","PAL, UDAY","Boston University","Not Designated",12/6/2024 3:24:46 AM
286,"American Association for the Advancement of Science, The (AAAS)",3444,"AAAS Fellow",1335388,"Uday B. Pal","2020",113949,"U25610682","0000-0001-5020-9396","PAL, UDAY","Boston University","Prestigious",12/6/2024 3:24:46 AM
488,"Minerals, Metals and Materials Society, The",19733,"EPD Technology Award",1476279,"Uday Pal","2003",113949,"U25610682","0000-0001-5020-9396","PAL, UDAY","Boston University","Not Designated",12/6/2024 3:24:46 AM
488,"Minerals, Metals and Materials Society, The",19733,"EPD Technology Award",1476287,"Uday Pal","2000",113949,"U25610682","0000-0001-5020-9396","PAL, UDAY","Boston University","Not Designated",12/6/2024 3:24:46 AM
488,"Minerals, Metals and Materials Society, The",19727,"EPD Distinguished Lecturer Award",1475718,"Uday Pal","2015",113949,"U25610682","0000-0001-5020-9396","PAL, UDAY","Boston University","Not Designated",12/6/2024 3:24:46 AM
488,"Minerals, Metals and Materials Society, The",19746,"LMD/EPD Energy Best Paper Award - Professional",1589543,"Uday Pal","2023",113949,"U25610682","0000-0001-5020-9396","PAL, UDAY","Boston University","Not Designated",12/6/2024 3:24:46 AM
54,"American Council of Learned Societies (ACLS)",479,"ACLS Fellows (ACLS/SSRC/NEH International and Area Studies Fellowships and ACLS/New York Public Library Fellowships)",292605,"Merry I. White","1990",114679,"U85490798","","WHITE, MERRY","Boston University","Highly Prestigious",12/6/2024 3:24:46 AM
330,"Association for Asian Studies",2713,"AAS NEAC Japan Studies Grants",545187,"Merry I. White","2015",114679,"U85490798","","WHITE, MERRY","Boston University","Prestigious",12/6/2024 3:24:46 AM
1567,"The Japan Foundation",8162,"Japanese Studies Fellowships",767776,"WHITE, Merry Isaacs","2007",114679,"U85490798","","WHITE, MERRY","Boston University","Not Designated",12/6/2024 3:24:46 AM
330,"Association for Asian Studies",2713,"AAS NEAC Japan Studies Grants",1661505,"Merry White","2021",114679,"U85490798","","WHITE, MERRY","Boston University","Prestigious",12/6/2024 3:24:46 AM
3590,"Association for the Study of Food and Society",24598,"ASFS Book Award",1764697,"Merry White","2013",114679,"U85490798","","WHITE, MERRY","Boston University","Not Designated",12/6/2024 3:24:46 AM
501,"Society for Social Work and Research",7493,"SSWR Fellow",653517,"Ruth Paris","2014",114801,"U32906091","0000-0002-3151-9070","PARIS, RUTH","Boston University","Not Designated",12/6/2024 3:24:46 AM
1460,"United States Department of State, Bureau of Educational and Cultural Affairs",1786,"Fulbright Scholar",979532,"Paris, Ruth","2015",114801,"U32906091","0000-0002-3151-9070","PARIS, RUTH","Boston University","Prestigious",12/6/2024 3:24:46 AM
1460,"United States Department of State, Bureau of Educational and Cultural Affairs",13189,"Fulbright Specialist",1484614,"Paris, Ruth","2016",114801,"U32906091","0000-0002-3151-9070","PARIS, RUTH","Boston University","Not Designated",12/6/2024 3:24:46 AM
379,"Social Science Research Council",2900,"Berlin Program for Advanced German and European Study",899419,"Gregory Williams","2003",115275,"U31837837","","WILLIAMS, GREGORY H","Boston University","Prestigious",12/6/2024 3:24:46 AM
190,"Getty Foundation, The",18677,"Getty Foundation Postdoctoral Fellowships",1351753,"Gregory Williams","2008",115275,"U31837837","","WILLIAMS, GREGORY H","Boston University","Not Designated",12/6/2024 3:24:46 AM
234,"National Endowment for the Humanities (NEH)",2147,"Summer Stipends Awards",1381410,"Williams, Gregory Hamilton","2020",115275,"U31837837","","WILLIAMS, GREGORY H","Boston University","Not Designated",12/6/2024 3:24:46 AM
492,"American Institute for Medical and Biological Engineering",3606,"Fellow",311347,"Joyce Wong","2009",116110,"U22927198","","WONG, JOYCE Y","Boston University","Not Designated",12/6/2024 3:24:46 AM
366,"National Science Foundation (NSF)",5815,"Faculty Early Career Development (CAREER) Program",603187,"WONG, JOYCE","2000",116110,"U22927198","","WONG, JOYCE Y","Boston University","Prestigious",12/6/2024 3:24:46 AM
1103,"Biomedical Engineering Society",7675,"BMES Fellow",717844,"Joyce Wong","2013",116110,"U22927198","","WONG, JOYCE Y","Boston University","Not Designated",12/6/2024 3:24:46 AM
286,"American Association for the Advancement of Science, The (AAAS)",3444,"AAAS Fellow",646770,"Joyce Y. Wong","2017",116110,"U22927198","","WONG, JOYCE Y","Boston University","Prestigious",12/6/2024 3:24:46 AM
221,"National Academy of Engineering",7726,"US Frontiers of Engineering Participant",1088817,"Joyce Y. Wong","2002",116110,"U22927198","","WONG, JOYCE Y","Boston University","Not Designated",12/6/2024 3:24:46 AM
221,"National Academy of Engineering",7726,"US Frontiers of Engineering Participant",1088730,"Joyce Y. Wong","2001",116110,"U22927198","","WONG, JOYCE Y","Boston University","Not Designated",12/6/2024 3:24:46 AM
267,"Society for Biomaterials",2366,"Clemson Award for Basic Research",1347913,"Joyce Y. Wong","2020",116110,"U22927198","","WONG, JOYCE Y","Boston University","Not Designated",12/6/2024 3:24:46 AM
510,"National Academy of Inventors",3717,"NAI Fellow",1337414,"Joyce Wong","2020",116110,"U22927198","","WONG, JOYCE Y","Boston University","Not Designated",12/6/2024 3:24:46 AM
3117,"Hartwell Foundation",19022,"Individual Biomedical Research Awards",1412319,"Joyce Y. Wong","2008",116110,"U22927198","","WONG, JOYCE Y","Boston University","Not Designated",12/6/2024 3:24:46 AM
221,"National Academy of Engineering",20253,"German-American Frontiers of Engineering Symposium Participant",1536524,"Joyce Y. Wong","2004",116110,"U22927198","","WONG, JOYCE Y","Boston University","Not Designated",12/6/2024 3:24:46 AM
221,"National Academy of Engineering",20253,"German-American Frontiers of Engineering Symposium Participant",1535767,"Joyce Y.  Wong","2013",116110,"U22927198","","WONG, JOYCE Y","Boston University","Not Designated",12/6/2024 3:24:46 AM
221,"National Academy of Engineering",20253,"German-American Frontiers of Engineering Symposium Participant",1535807,"Joyce Y.  Wong","2012",116110,"U22927198","","WONG, JOYCE Y","Boston University","Not Designated",12/6/2024 3:24:46 AM
221,"National Academy of Engineering",20253,"German-American Frontiers of Engineering Symposium Participant",1536336,"Joyce Y. Wong","2001",116110,"U22927198","","WONG, JOYCE Y","Boston University","Not Designated",12/6/2024 3:24:46 AM
221,"National Academy of Engineering",20253,"German-American Frontiers of Engineering Symposium Participant",1536400,"Joyce Y. Wong","2002",116110,"U22927198","","WONG, JOYCE Y","Boston University","Not Designated",12/6/2024 3:24:46 AM
221,"National Academy of Engineering",20254,"Japan-America Frontiers of Engineering Symposium Participant",1529012,"Joyce Y. Wong","2013",116110,"U22927198","","WONG, JOYCE Y","Boston University","Not Designated",12/6/2024 3:24:46 AM
221,"National Academy of Engineering",20254,"Japan-America Frontiers of Engineering Symposium Participant",1529013,"Joyce Y. Wong","2012",116110,"U22927198","","WONG, JOYCE Y","Boston University","Not Designated",12/6/2024 3:24:46 AM
3232,"International Academy of Medical and Biological Engineering",19684,"IAMBE Fellow",1466850,"?Joyce Y. Wong","2021",116110,"U22927198","","WONG, JOYCE Y","Boston University","Not Designated",12/6/2024 3:24:46 AM
366,"National Science Foundation (NSF)",5815,"Faculty Early Career Development (CAREER) Program",741298,"XI, HONGWEI","2001",116610,"U80918932","0000-0003-1289-7794","XI, HONGWEI","Boston University","Prestigious",12/6/2024 3:24:46 AM
121,"American Society for Theatre Research",1185,"ASTR/IFTR Fellowship/Thomas F Marshall Travel Fellowship",15884,"Harvey Young Jr.","1999",117262,"U45774021","","YOUNG, HARVEY","Boston University","Not Designated",12/6/2024 3:24:46 AM
234,"National Endowment for the Humanities (NEH)",2147,"Summer Stipends Awards",50412,"Harvey Young","2005",117262,"U45774021","","YOUNG, HARVEY","Boston University","Not Designated",12/6/2024 3:24:46 AM
229,"National Communication Association",3227,"Lilla A Heston Award for Outstanding Scholarship in Interpretation and Performance Studies",305227,"Harvey Young","2011",117262,"U45774021","","YOUNG, HARVEY","Boston University","Prestigious",12/6/2024 3:24:46 AM
121,"American Society for Theatre Research",1187,"Errol Hill Award",302853,"Harvey Young","2011",117262,"U45774021","","YOUNG, HARVEY","Boston University","Prestigious",12/6/2024 3:24:46 AM
968,"Association for Theatre in Higher Education",6673,"Excellence in Editing",597023,"Harvey Young","2014",117262,"U45774021","","YOUNG, HARVEY","Boston University","Not Designated",12/6/2024 3:24:46 AM
121,"American Society for Theatre Research",10618,"Helen Krich Chinoy Dissertation Research Fellowship",993782,"Harvey Young","2001",117262,"U45774021","","YOUNG, HARVEY","Boston University","Not Designated",12/6/2024 3:24:46 AM
121,"American Society for Theatre Research",1182,"ASTR Honorees/Distinguished Scholar",1438218,"Harvey Young","2021",117262,"U45774021","","YOUNG, HARVEY","Boston University","Highly Prestigious",12/6/2024 3:24:46 AM
1130,"Harvard University",18790,"Charles Warren Center for Studies in American History/Fellows",1357984,"Harvey Young?","2012",117262,"U45774021","","YOUNG, HARVEY","Boston University","Not Designated",12/6/2024 3:24:46 AM
3630,"College of Fellows of the American Theatre",24848,"Member",1815270,"Harvey Young","1900",117262,"U45774021","","YOUNG, HARVEY","Boston University","Not Designated",12/6/2024 3:24:46 AM
6,"American Academy of Arts and Sciences",101,"American Academy of Arts and Sciences Member/Fellow",3714,"Robert Pinsky","1993",117281,"U78323863","","PINSKY, ROBERT","Boston University","Highly Prestigious",12/6/2024 3:24:46 AM
1,"Academy of American Poets",2,"Harold Morton Landon Translation Award",4496,"Robert Pinsky","1995",117281,"U78323863","","PINSKY, ROBERT","Boston University","Not Designated",12/6/2024 3:24:46 AM
1,"Academy of American Poets",4,"Lenore Marshall Poetry Prize",7869,"Robert Pinsky","1997",117281,"U78323863","","PINSKY, ROBERT","Boston University","Not Designated",12/6/2024 3:24:46 AM
254,"Phi Beta Kappa Society",3233,"Award for Distinguished Service to the Humanities",239715,"Robert Pinsky","2003",117281,"U78323863","","PINSKY, ROBERT","Boston University","Highly Prestigious",12/6/2024 3:24:46 AM
191,"John Simon Guggenheim Memorial Foundation",1809,"Guggenheim Fellowship",288520,"Robert Pinsky","1980",117281,"U78323863","","PINSKY, ROBERT","Boston University","Highly Prestigious",12/6/2024 3:24:46 AM
473,"American Academy of Arts and Letters",3552,"Arts and Letters Awards",378289,"Robert Pinsky","1980",117281,"U78323863","","PINSKY, ROBERT","Boston University","Not Designated",12/6/2024 3:24:46 AM
486,"PEN America",5810,"PEN/Voelcker Award for Poetry",535346,"Robert Pinsky","2004",117281,"U78323863","","PINSKY, ROBERT","Boston University","Not Designated",12/6/2024 3:24:46 AM
2587,"Saginaw Valley State University",16138,"Theodore Roethke Memorial Poetry Prize",1131800,"Robert Pinsky","2008",117281,"U78323863","","PINSKY, ROBERT","Boston University","Not Designated",12/6/2024 3:24:46 AM
1206,"Pushcart Press",6330,"Pushcart Prize",1383362,"Robert Pinsky","2021",117281,"U78323863","","PINSKY, ROBERT","Boston University","Not Designated",12/6/2024 3:24:46 AM
2554,"Stanford University",16105,"Wallace Stegner Fellowships",1672382,"Robert Neal Pinsky","1964",117281,"U78323863","","PINSKY, ROBERT","Boston University","Not Designated",12/6/2024 3:24:46 AM
1139,"National Institutes of Health (NIH)",9927,"NIH Outstanding Investigator Award (R35)",909172,"PORCO, JOHN A","2016",117785,"U08344489","0000-0002-2991-5680","PORCO, JOHN A","Boston University","Not Designated",12/6/2024 3:24:46 AM
298,"Acoustical Society of America",7982,"R. Bruce Lindsay Award",748149,"Tyrone M. Porter?","2008",117815,"U60109185","0000-0002-7239-4091","PORTER, TYRONE","Boston University","Not Designated",12/6/2024 3:24:46 AM
298,"Acoustical Society of America",8247,"Fellow",789703,"Tyrone M. Porter","2016",117815,"U60109185","0000-0002-7239-4091","PORTER, TYRONE","Boston University","Not Designated",12/6/2024 3:24:46 AM
492,"American Institute for Medical and Biological Engineering",3606,"Fellow",1380162,"Tyrone Porter","2021",117815,"U60109185","0000-0002-7239-4091","PORTER, TYRONE","Boston University","Not Designated",12/6/2024 3:24:46 AM
1824,"American Federation for Aging Research",15971,"U.S. National Academy Medicine Catalyst Award Competition",1778277,"Tyrone Porter","2021",117815,"U60109185","0000-0002-7239-4091","PORTER, TYRONE","Boston University","Not Designated",12/6/2024 3:24:46 AM
298,"Acoustical Society of America",24576,"Frederick V. Hunt Postdoctoral Research Fellowship in Acoustics",1759350,"Tyrone M. Porter","2003",117815,"U60109185","0000-0002-7239-4091","PORTER, TYRONE","Boston University","Not Designated",12/6/2024 3:24:46 AM
280,"Dance Studies Association",2441,"The de la Torre Bueno Prize",309413,"Carrie J. Preston","2011",118006,"U20029412","","PRESTON, CARRIE J","Boston University","Not Designated",12/6/2024 3:24:46 AM
328,"Andrew W. Mellon Foundation",15138,"Sawyer Seminar",1610246,"Carrie Preston","2022",118006,"U20029412","","PRESTON, CARRIE J","Boston University","Not Designated",12/6/2024 3:24:46 AM
92,"American Physical Society",3020,"APS Fellow",209469,"Redner, Sidney","1999",119321,"U80377384","0000-0001-5906-4904","REDNER, SIDNEY","Boston University","Not Designated",12/6/2024 3:24:46 AM
92,"American Physical Society",8562,"Outstanding Referee",821397,"Sidney Redner","2008",119321,"U80377384","0000-0001-5906-4904","REDNER, SIDNEY","Boston University","Not Designated",12/6/2024 3:24:46 AM
92,"American Physical Society",19774,"Leo P. Kadanoff Prize",1473787,"Sidney Redner","2021",119321,"U80377384","0000-0001-5906-4904","REDNER, SIDNEY","Boston University","Not Designated",12/6/2024 3:24:46 AM
366,"National Science Foundation (NSF)",5815,"Faculty Early Career Development (CAREER) Program",1016792,"Leonid  Reyzin","2006",119645,"U05105469","","REYZIN, LEONID","Boston University","Prestigious",12/6/2024 3:24:46 AM
68,"American Geophysical Union",3545,"Union Fellow",298732,"Guido Salvucci","2003",121257,"U84695107","0000-0003-3609-5972","SALVUCCI, GUIDO D","Boston University","Not Designated",12/6/2024 3:24:46 AM
299,"American Meteorological Society",3347,"The Editor's Award",243804,"GUIDO SALVUCCI","2005",121257,"U84695107","0000-0003-3609-5972","SALVUCCI, GUIDO D","Boston University","Not Designated",12/6/2024 3:24:46 AM
68,"American Geophysical Union",584,"James B Macelwane Medalists",35524,"Guido Salvucci","2003",121257,"U84695107","0000-0003-3609-5972","SALVUCCI, GUIDO D","Boston University","Prestigious",12/6/2024 3:24:46 AM
458,"Office of Naval Research (ONR)",3477,"Young Investigator Program Award (YIP)",584109,"Stan Sclaroff","1996",122197,"U72948451","0000-0002-0711-4313","SCLAROFF, STANLEY E","Boston University","Prestigious",12/6/2024 3:24:46 AM
350,"Institute for Electrical and Electronics Engineers (IEEE)",3526,"IEEE Fellow",718970,"Stanley Sclaroff","2017",122197,"U72948451","0000-0002-0711-4313","SCLAROFF, STANLEY E","Boston University","Not Designated",12/6/2024 3:24:46 AM
1604,"Google",8593,"Google Faculty Research Award",830491,"Stan Sclaroff","2010",122197,"U72948451","0000-0002-0711-4313","SCLAROFF, STANLEY E","Boston University","Not Designated",12/6/2024 3:24:46 AM
1476,"International Association for Pattern Recognition",17186,"IAPR FELLOW",1298132,"Stan Sclaroff","2016",122197,"U72948451","0000-0002-0711-4313","SCLAROFF, STANLEY E","Boston University","Not Designated",12/6/2024 3:24:46 AM
366,"National Science Foundation (NSF)",5815,"Faculty Early Career Development (CAREER) Program",1014560,"Joshua  Semeter","2006",122415,"U97460789","0000-0001-7442-6205","SEMETER, JOSHUA L","Boston University","Prestigious",12/6/2024 3:24:46 AM
512,"IEEE Electron Devices Society",3722,"Paul Rappaport Award",432293,"William J. Skocpol","1985",123513,"U94020249","","SKOCPOL, WILLIAM","Boston University","Not Designated",12/6/2024 3:24:46 AM
92,"American Physical Society",8562,"Outstanding Referee",821836,"W. J. Skocpol","2009",123513,"U94020249","","SKOCPOL, WILLIAM","Boston University","Not Designated",12/6/2024 3:24:46 AM
92,"American Physical Society",3020,"APS Fellow",765558,"Skocpol, William John","1987",123513,"U94020249","","SKOCPOL, WILLIAM","Boston University","Not Designated",12/6/2024 3:24:46 AM
170,"Council for Advancement and Support of Education",1712,"Carnegie Professor of the Year State Winners",25707,"Kevin Smith","2001",123734,"U81183739","","SMITH, KEVIN E","Boston University","Not Designated",12/6/2024 3:24:46 AM
153,"American Vacuum Society(AVS)",1615,"Fellow of the Society",59737,"Kevin E. Smith","2007",123734,"U81183739","","SMITH, KEVIN E","Boston University","Not Designated",12/6/2024 3:24:46 AM
92,"American Physical Society",3020,"APS Fellow",207432,"Smith, Kevin E.","2009",123734,"U81183739","","SMITH, KEVIN E","Boston University","Not Designated",12/6/2024 3:24:46 AM
1460,"United States Department of State, Bureau of Educational and Cultural Affairs",1786,"Fulbright Scholar",318333,"C Allen Speight","2011",124184,"U25031955","","SPEIGHT, C ALLEN","Boston University","Prestigious",12/6/2024 3:24:46 AM
468,"American Academy in Berlin",3522,"Berlin Prize Fellow",262699,"Allen Speight","2003",124184,"U25031955","","SPEIGHT, C ALLEN","Boston University","Not Designated",12/6/2024 3:24:46 AM
1269,"William T. Grant Foundation",6556,"William T. Grant Scholar",588206,"Renee Spencer","2010",124202,"U52195639","0000-0002-2876-2918","SPENCER, RENEE","Boston University","Not Designated",12/6/2024 3:24:46 AM
501,"Society for Social Work and Research",7493,"SSWR Fellow",1096457,"Renee Spencer","2020",124202,"U52195639","0000-0002-2876-2918","SPENCER, RENEE","Boston University","Not Designated",12/6/2024 3:24:46 AM
500,"American Academy of Social Work and Social Welfare",3669,"Fellow",1516842,"Renee Spencer","2022",124202,"U52195639","0000-0002-2876-2918","SPENCER, RENEE","Boston University","Not Designated",12/6/2024 3:24:46 AM
354,"John Templeton Foundation",10695,"Templeton Grants",1627291,"Renee Spencer","2022",124202,"U52195639","0000-0002-2876-2918","SPENCER, RENEE","Boston University","Not Designated",12/6/2024 3:24:46 AM
3300,"Memory Disorders Research Society",20060,"Member",1510314,"Chantal Stern","1900",124673,"U90654015","","STERN, CHANTAL E","Boston University","Not Designated",12/6/2024 3:24:46 AM
80,"American Mathematical Society",4522,"AMS Fellow",573867,"Glenn H. Stevens","2016",124703,"U80519656","","STEVENS, GLENN HOWARD","Boston University","Not Designated",12/6/2024 3:24:46 AM
288,"National Academies, The",2496,"Jefferson Science Fellows at the US Dept of State",219403,"James Stone","2009",124873,"U02193177","","STONE, JAMES","Boston University","Not Designated",12/6/2024 3:24:46 AM
37,"American Astronomical Society",322,"Bruno Rossi Prize",247276,"James L. Stone","1989",124873,"U02193177","","STONE, JAMES","Boston University","Not Designated",12/6/2024 3:24:46 AM
1118,"National Aeronautics and Space Administration (NASA)",8239,"Exceptional Achievement Medal",786712,"STONE, JAMES A.","2003",124873,"U02193177","","STONE, JAMES","Boston University","Not Designated",12/6/2024 3:24:46 AM
958,"Breakthrough Prizes",4451,"Breakthrough Prize in Fundamental Physics",988592,"James L. Stone","2016",124873,"U02193177","","STONE, JAMES","Boston University","Not Designated",12/6/2024 3:24:46 AM
3,"Alfred P. Sloan Foundation",24,"Sloan Research Fellowship-Chemistry",204370,"John E. Straub","1995",124966,"U45520392","0000-0002-2355-3316","STRAUB, JOHN E","Boston University","Prestigious",12/6/2024 3:24:46 AM
492,"American Institute for Medical and Biological Engineering",3606,"Fellow",311501,"Bela Suki","2007",125205,"U00208253","0000-0002-9720-1006","SUKI, BELA","Boston University","Not Designated",12/6/2024 3:24:46 AM
1103,"Biomedical Engineering Society",7675,"BMES Fellow",776440,"Suki, Bela","2016",125205,"U00208253","0000-0002-9720-1006","SUKI, BELA","Boston University","Not Designated",12/6/2024 3:24:46 AM
